"Islam makes for wonderfully tolerant, enriching and inclusive societies. It's not only a religion of peace but of joy as well."
"that is a silly statement. the Jewish people had rules set out by God, and I am a gentile."
The Trudeau cabinet members and staff appear to have no sense of ethical responsibility. Brison's response is cavalier and shows he is completely unaware that this is a serious allegation of impropriety. Having a gay husband doesn't give him a free pass.
I am not anti-gay. i am for gay rights as long as they are not superior to rights of others. Neither of these two facts are evidence of support for the assertion of choice.
Maybe we should ask his Orthodox Jewish son-in-law and his daughter who converted to the faith  why he is such an anti-Semite.
The case of Sauve v. Canada was about the right of a person who is incarcerated in the prison system and does not address residency. In fact the decision refers to ' certain permanent residents' also 'citizens and residents'
"According to NEWSWEEK, 'Border Wall Tied to Trump Transgender Ban'. http://www.msn.com/en-us/news/politics/border-wall-tied-to-trump-transgender-ban-report/ar-AAoSxVS?li=BBnb7Kz"
"Or maybe considering how it's ISLAM which specifically officially and quite repetitively commands the global genocide of all the non-muslim cultures, religions, and peoples of the world, it's only a legal, moral, and defensive stance? Unless you think 'muslims' are a 'race?'  ;-)"
The future of the Catholic Church in this country is becoming more and more Hispanic.  That is one of the reasons so many white Catholics jumped on Trump's racist bandwagon.
Tabby Cat is using it in a disgusting offensive way and damn right it's a slur. It's a slur against every single non-transsexual person out there.    Wake up. The 'victims' of bigotry are now the bullies.   Tabby Cat isn't funny and should be dismissed for her hateful rant.
"MEN OF CALGARY: GO GAY! It is the only thing that will save your skin. But in today's heated feminist empire, being gay may not be a defence from an accusation of sexual impropriety."
Martin is a homosexual and wants to be able to let everyone know.  Like all the homosexuals feel compelled to do for some reason.
Christianity at least is based on 'turn the other cheek'.
"These are matters of facts, not belief.  You can certainly try to brainwash gay people into thinking they are straight, but it has not been shown to work very well."
I am NOT protecting or condoning the alleged behavior!  I'm pointing out the 'he did this because he is gay' bigotry.
Which 'Church' are you referring  to...the Roman Catholic Church  or the True Christian Church?
"Well, if she's only gay at church..."
"[To those with the right shoe size:]  Surgery? A lie. Outgrow TG 'feelings'? Non-trans do. Trans children never, and when imprisoned in a strange body, the results are often tragic and lethal. This should be criminal? Depriving children of necessary, yes it's necessary, medical treatment for GD is already criminal, child abuse."
"Here we go again - the rant about the Crusades, which were the Catholics, when people use this argument they simply showcase their ignorance."
Feeding christians to lions needs to be a thing again.
As soon as Freeland has NAFTA and the Chechen gay holocaust fixed I would like to see Trudeau set her on the little North Korean psychopath.
"With so many people making the news today by claiming to be gay, it will not be many years before someone makes the news by claiming to be straight."
"That is called a cilice, they are de rigeure for the Catholic in the know, paired with a hair shirt and optional chastity belt (now available in both male and  female styles), you will never go wrong!  Available at the nearest Opus Dei outlet mall!"
Slavery killed a lot more Africans than Nazism did Jews.'  How did you calculate this?
"Not all Republicans are racists. However, they are all collaborators with racists. They are like the 'good Germans' that never asked, where did the Jews disappear to? Today, they never question why cops kill so many unarmed black  people, including children."
"The hypocrisy of leaning on Christianity as a crutch that dignifies and attempts legitimacy is front and center, in the past, present, and future. So much to look forward too."
But EWTN types told me that women have the important role in the Catholic Church doing all the menial grunt work that men don't want to under the 'leadership' of the more intelligent malefolk.  Sarc off/
It's tough being a gay guy these days.  LOL
Well - in Ontariowe they did what the politicians said ! How is that working for us ....
"These women should spend a year in Iran, Iraq, Syria or any other Muslim country then tell me how oppressed they are in the US."
"it's still male bones in there , be trans but don't try to compete with biological women, it's unfair . there should be special categories for trans athletes to compete against each other ."
"As Justin said about the arms sale to Saudi Arabia, one cannot interfere with the sanctity of a government contract."
I wonder how many people remember that Quebec was once the most difficult province to live in if you were Jewish.
Drake is half black. Being a Jew is not a race its a set of ideas like other religions. Ivanka Trump is Jewish because she converted nothing to do with this talk about race and other nonsense.
"Mr. President, the  Chinese just invaded Taiwan'. 'Get Jew boy on it...I'm busy trying to come up with a killer tweet to put that nasty Samantha Bee in her place'..."
I have heard the mothers of trans Americans often feel like they are 'transparent'
He is excited about being gay i guess
LOL.  Please tell me it includes the one that thinks that having boys do household chores turns them gay.
"Trump speaks to solid Americans.  The ones who work hard for modest wage.  The democrats speak to special interests such as the gays, illegal immigrants, and rich narcissists who view themselves as better than their fellow Americans."
"If Francis is concerned about the health of Vatican staff....what about the health hazards associated with gay sex (including depression, AIDS, suicide) and cocaine use among Vatican staff?"
Literally the dumbest shit I've read in decades.
What a disgusting person.  How many offensive things has he said about other people and never apologized for.    What she tweeted happens to be true.   After all there were GOOD people chanting 'Jews will not replace us' at the white supremacist rally.
It's like giving a dying patient a transfusion with blood from his other arm.
All that is necessary for the triumph of evil is that good men do nothing. ~ Edmund Burke
And so a new orthodoxy was born.
Jews are whites too and whites are not the most advanced race either.
"Not surprising Nikki, considering that millions serve and only a very tiny fraction are 'trans.'  It is using statistics to make a false point."
He wanted to hold an anti-lgbt rally right before the Pride festival? Disgusting. Thereâ€™s no room for that kind of hatred here on the Harbor. Itâ€™s easy to believe the rest of the story when the ownerâ€™s actions at city hall show whatâ€™s in his heart.
"Oh deer: Hitler really! I have nothing but respect for Jews, they are truly a remarkable people. It's you retread, left wing , tambourine banging, pot circle sloths I have no time for. Ps love your conspiracy theories, do you hear voices?"
"The modernity comment was solely regarding the sentence on transgender folks.  And that is a modern phenomenon. Not in terms of the existence of such folks, but of the familiarity of enough laypersons to raise the subject to the level of commonplace everyday conversation."
"Well for starters, you're an excellent example of an off-putting individual, gay or otherwise.  Prefacing your rhetorical question w/an accusation isn't going to generate good will any time soon now is it?"
Gary:  Are you a Homosexual??????
Nope.  Trump's campaign promise was a Muslim ban.
How do you progs become such extremists?
Glad he dealt with this because the issue of transgender soldiers in the military was keeping me up at night as one of the greatest problems currently facing the nation. (sarcasm)
"colon7, you are partially right. Religion is the problem. A minority of one religion."
It was not immigrants that caused the carnage at that mosque.  It was not multiculturalism. It was not Islam. It was sheer unadulterated hatred. Pure bigotry. Revolting xenophobia.   Your attempt to justify the slaughter in Quebec is beyond repulse.
Part of living under Russian rule is that gays don't have rights. Perhaps you liberals would be happier living outside the USSR?
"Because, in this instance at least, the Vatican is making a big deal over nothing."
"Of course you did, Duke. You often do do. Your dour attitude and denigration of something as basic as human joy puts you far closer to the Islamists than to the rest of us. You deserve pity."
Most people that spout Jesus this or that are usually two faced hypocrites. Go back to watching your porn...
And I bet that in the day you expected your Jewish classmates to smile when you walked into that exclusive country club.  And you expected your black classmates to do the honourable thing and avoid using the whites only washrooms and lunch counters.
"No, the Saudis are the largest funder of Daesh, which is a natural expression of Wahhabism. How many Christians, Jews or Atheists live in Mecca?"
I wouldn't say that 'Being gay has nothing to do with being a pedarast.' Pederasty is a 'sub-set' of male homosexuality. So a pederast is a homosexual male while not all homosexual males are pederasts. So 'nothing to do with' is overstating it.
"So you think it's un-Christian for a nation to have borders?  Absurd.  And since when are you a Christian fundamentalist?  Unless it's in the Bible, it's wrong?  Absurd.  Love requires we take in all the poor who manage to cross our borders?  Absurd."
"I thought a fresh batch of trolls.  Probably from 'Church Militant.' Same crowd historically that favored slavery, lynched, segregated, slaughtered natives. 'Onward Christian Soldiers,' again; battle ready."
"This is not shocking.  If women can do it, why not gays?  Now wait for 213 men to board the allegation bus.  We've known Kevin is gay for many years.  No big deal."
If he'd shot santa would it have been christian terrorism? Or 'just' a mentally ill person? Just sayin'.
"These Scientists are morons globalists. We were in a doomsday situation until Trump won, now we can all relax. Not surprised one iota there is a Jew behind the moving of the Clock, Israel may be facing justice for it's crimes and we can't have that now can we. Marxist globalist BS."
"And one can assume you lived at home - always a dividend, Orderkaos. Mrs. P has nailed it, with serious input from the real world by Mike. Margaret's experiences are of another age."
Infowars?  Congratulations on losing all credibility. Have another beer and watch more TV.  Obama made my frog gay with chemicals while cloning 9/11!
"They are too busy fighting pro-choice, lgbt rights,  and making excuses on what Trump 'really meant.'"
"Hey Broom Closet, I see you haven't seen your doctor yet."
The irony is that those who support Ford's right-wing populism are exactly those who most benefit from social programs and the taxes that pay for them. This has been the 'success' of Canada's right wing: making taxation a dirty word.
Your concern would be touching if it weren't a canned talking point.  Nobody needs to be trans or a soldier to be in danger in these third world dumpster fires. If you walk upright you qualify.  The best solution ? Stay out of these 'heck' holes.
"I take issue with 'the god of the Jewish Bible is a cruel, vindictive, angry assassin'.  In addition it appears to be unrelated to the article."
"Lay off the Oxy, Von...."
Just in -  Trump has transgendered from female rattle snake to spitting cobra!
The problem secularists seem to have with Christians is they mistake the Christian disciplines we impose on ourselves as being judgemental on their secular ways. People who are truly comfortable in their own ways don't have this issue.
"You make no sense whatsoever. You're saying that it's perfectly rational to subjugate and dehumanize women, homosexuals, and Atheists?"
"He lamented that more children in the United States are raised in families led by unmarried mothers.'  We lament that, too, but don't put that one gay people.  Gay couples, in most cases, are helping children who were abandoned, as if they were strays."
"Rest easy, Harper will win the next election and just like Benjamin Yahoo he will repeal this legislation and blame his Finance Minister for this stupidity."
Something gay went wrong
Don't remember you. Obviously no one cared what you said.Â 
We treat the 2nd Amendment like a death lottery and we are all potential blood sacrifices. How many of those concert goers thought they had bought lottery tickets? I thought Jesus made human sacrifices unnecessary. I'm sure a lot of those concert goers thought they were Christians.
"You like to use the word Facist, seth. Do please tell us what you understand that label to mean. Then compare and contrast your 'notion' with reality."
"While essentially agreeing with all the above, I'd suggest we not forget the striking history of anti-Jewish pogroms over the hundred years prior to the Bolshevik revolution."
"Allowing perverted young males posing as transgenders to have access to female bathrooms will also have 'consequences'.  Rapes or suicides, what's your choice?"
"Oh, come on, Thatcher - you didn't even mention the current Jones/Infowars conspiracy theory that Jewish actors were impersonating the white supremacists, KKK and Nazis to discredit them. You're slipping."
There are very few people who are really transgendered with chromosomal abnormalities. Others who feel between genders would benefit from therapy..less drastic than genital mutilation followed by a lifetime taking hormone therapy
"When a Christian performs a terrorist act, do you label it a Christian act of terrorism?  People of all religions engage in terrorist acts, most North American terrorist acts are perpetrated by Christians, because they're the majority of terrorists in North America."
Peter MacKay: He?s the Minister of Wrong Again... Why is it that everything the harper CONservatives do is WRONG ????
While we're sharing personal facts that have nothing to do with the column: My dog has a fluffy tail.
Trump's tweets expertly tilt the scales of justice against his Muslim ban
How is baking a cake for a gay couple exceeding his obligations?
The fact that transgender people need medical treatment for their condition tells it all.  Normal people come either male or female and require no medical treatment to stay that way.
uniquely Canadian' really means 'from Cana-duh'
Another way the Catholic Church can distract from the fact that they condone child rape.
If a military draft is necessary during war time is Trump prepared to give Trans-gendered people an exemption? Or do exemptions only apply to rich kids with heel spurs?
Science applied with your sense of the 'sacredness of the planet' and just a smidgin' of concern for one's offspring ?
Islam teaches hate. Muslims need to be run out of this country. They are a disgusting death cult
Lots of people are happy to live under a dictator as long as they feel safe.
globe editors.. stooping to new lows every day... Run along little editors... Harper beckons with more lies..
What is ridiculous is suggesting an equivalency between the number of attacks on jews in Canada and the number of attacks  on Irish people in Canada.
Of course Trump blames the black guy.  Hurricane Maria was the fault of Puerto Ricans.  The Jews caused Nazis.   Blacks force themselves to be abused by the cops.
A priest raping a child is hysterical.  Your comment history shows your reverence for the church and seems to be missing the teachings of Christ.
"One of the hallmarks of a complex mind or a complex civilization is the ability to recognize, focus on, and address REAL problems. Which bathroom transgender people use, isn't one of them."
a Mosque is a Mosque is a Mosque Where else do they teach their Hate for non-Muslim's?
â€œdon we now our gay apparel.â€ ? What is Kahle suggesting? Kahle is gay and his class mates knew he was? Or is Kahle sneaking in a homophobic slur and in the RG no less?
"It is so revealing all these Republicans saying 'I have a wife, daughter and mother.'  You don't know any Muslims? Any Mexican immigrants? That in itself is deplorable."
"its a jewish democracy, get over it, you and kerry are idiots"
"Refresh my memory, which religion killed millions of people in the name of imperialism or then thousands of people in Ireland or during the Thirty Years War or during fascist rule in Spain, Italy and Germany."
Chuckie isnâ€™t the sharpest knife in the drawer
I always like hearing from a 'true - blue Conservative' as you have claimed to be on past posts. Keep it up......................................./sarc
"Alceste, Paris voted 10% Le Pen Paris is  20 % Muslim ? 20 % other immigrants ? 50% urban leftists? - so why is that surprising?"
Is that a slur on Burke's sexual orientation?  You have given the impression of being beyond that.  Gay jokes from an anti-homophobe.  LOL.
"TO Blackfly and eCitizenfirefighters, police and ...teachers and TTCare examples of OVERPAID public sector UNIONIZED salariesthat people oppose but because Ford also opposes then the Ford Haters oppose Fordsort of cut off your nose to spite your face"
"...are you talking about the Jewish 'propaganda movies' ? Anne Frank... about the Third Reich... about this...about that...on every chanels of the world... once a week...'when you run out movie ideas', eh ?"
"if you believe trannies are mentally healthy then you have lost touch with reality...it's classic body dysmorphia involving mutilation, self-harm, acting out...obviously this CG idiot needs to be fired and forced out of normal society"
"You have the disgraceful temerity to draw a moral equivalence between the Holocaust and the Jewish recovery miracle, and the Palestinian fourth generation, UN tit-sucking, Jew-hating refugee bullshit story. It's exceedingly charitable to describe you as a libtard."
Simple answer: people who don't like muslims care.
"Freedom of expression should not include allowing women to be repressed or supporting Islamic extremists. i wish I could reference an article in the G&M, written by two Muslim women as to why we should not support the wearing of the niqab."
More poverty for average joe hardworking taxpayer on a fictitious problem.
"It's always a flukwing Jew, isn't it?"
There is no 'peace' on this one princeed8.
"Diversity should be restricted to the public sector, where merit isn't relevant."
It would be nice to see a transgendered black Latina beat Trump in 2020.
you are so naive.
When Lori has a PF named Persico he should really keep quite about issues gay.
"As night fell Friday and Texas braced for a generational storm, Trump pardoned a racist political ally and ordered an indefinite ban on transgender servicemembers joining the military."
"Forgive me for being ignorant, I really just don't know -- 'transgender woman', that means which way?  I mean ... well, what parts are there."
"Compassion if necessary, but not necessarily compassion'"
"Agreed that Parliament should legislate the terms and limitations. But let's just wait until we have a real Parliament, not the current one, with its 34% emperor..."
They are the freakie new breed of drag queens. They can't even admit they are gay.
Oh yes letâ€™s cut all social security pensions and healthcare payments and let people starve to death
"Wyatt are you a transvestite, Transsexual, or just a Man that just hates himself for being what you are? Do you have a hard time competing against your gender?  Get real, look in your shorts Dude!"
"Exactly like the baker who will not bake cakes for gays, except no one fraudulently allowed him to discriminate."
Republican controlled only in theory even Republicans can't stomach Cheetolini your religious SAVIOUR ... lol ... 'christians' are foul and evil as is evidenced by YOUR President :)
"Klastri, back to name calling when you can't explain a comment you made.  You said transgenders in the military is a civil right.  A sharp lawyer like you ought to be able to defend your position, so why can't you?"
"Wow, there sure are a lot of ugly posts here this morning."
Did you watch the videos? Only one side was chanting about killing Jewish people and listening to a KKK leader speak.
They have the same rights to life and security of the person as you do.
"Just an excuse?' That's an interesting way to describe the targeted murder of six people. If it had been six Jews that were killed, would you have the same objection to a motion that condemned violence against them?"
"What a disgusting apologist stance!! G&M endorsed Harper last election, and it looks like they have neither been paying attention nor learned anything since!! The worst accountability problems Canada has ever seen stem from the CPC Party!!"
But no one can actually demonstrate why homosexuality is intrinsically degenerate. Not without relying on circular reasoning.
"Yes because when I think of the PLO, Hamas, and Islamic Jihad the first thing that comes to mind is: law, morality, and ethics."
"WTF?  He's Jewish and should be well aware that lineage is traced through the female line.  Second, what kind of message does this send to his daughters?  Sorry, girls you aren't good enough for me.  I need a son."
"free trade, and unfettered shipping of jobs to places like india is what is pushing us into poverty, we have a moral obligation to help canadians before foreigners"
Lori lives in an ivory tower and hasn't stepped out into the real world yet.
"Ah, so it is only symbolic then ? ... how about the whole religion and all (man-made) religions are symbolic (i.e. created by man to suit his spiritual needs)."
"Gazans could have built a power plant & a sewage treatment plant, but they decided that it was more important to build tunnels into Israel to murder innocent Jews."
Please post the stats on racial profiling and police shootings of Asians and Jews. I'll wait.
"Typical looney bin democrat rent-a-mob.  A collection of neurotic women, homeless trans-whatevers and effete metrosexuals.  Yikes!"
"First of all. Modernism is passe. We are living in a post-modern world. SOme even say post post-modern.   Second, I stand by what I said.  Utter nonsense--specifically, the One, Holy, Catholic part. As far as 'outside of which' that is simply not provable."
"Changing the subject...? Compartmentalizing is just another form of cognitive dissonance. Sorry I refuse to debate you any longer. You don't like your 'sacred' things being questioned, that's obvious."
Guy who wrote the bathroom bill loses to a transgender opponent.........delicious.
Ya you are probably right... getting rid of Islam would probably get rid of all those as well.... good point
"The Nazis killed 6 million Jews, the Republican Party thinks nothing of attempting to kill 30 million Americans."
Or bakers not baking homosexual wedding cakes.
Rodney Howard-Browne is a heretic and an embarrassment to Christianity.
Lattes and Danish. The USA will protect us.
The Holy Bible is wholly babble. It's a bookfull of lies and ancient superstitions. The good news is the trend is overwhelmingly against religion and towards commonsense and science.
Trudeau is like all other politicians on the left. They have abandoned the LGBTQ community in favour of another community that persecutes and murders gays. Trudeau certainly wouldn't wish to offend his new best friends - the ones with the quaint cultural practices that offend most civilized people.
I am happy the community allows dissenting voices. I wouldn't subscribe here if all dissenting voices were banned like in other pathetic groups I've been in.Â 
"If this insanity continues, one cannot help but wonder if Ivanka will eventually be forced to choose between her racist daddy (and his low-info racist supporters), and her Jewish husband.    Boy, do I miss having the adults in charge of things. Not surprising most Americans miss Obama."
This is silly.  Hardly any Catholics believe that contraception is wrong.   https://www.americamagazine.org/content/dispatches/us-catholics-hold-mixed-views-religious-liberty-issues
"But it was okay to put drug dealers under house arrest so they could wander into the Eaton Centre and shoot it up, right? Wouldn't want a violent criminal with an illegal handgun in prison would we Liberals?"
Mooreâ€™s candidacy points to what everyone should abhor:  Extremist Christian nationalism.  Elimination of the separation of Church and State is their primary goal.  (â€¦and they get to define the official religion as whatever suits their agenda as they go along.)  Roy Moore is simply another psychotic whack right wing candidate.
Be careful what you wish for Jimmy.  Minorities are generally not treated well by republicans.  Who knows what will happen to you.  You might even be sent to Gitmo because they think you are Muslim.
"Actually I do, but maybe it is you that does not? Do you work for the government? Seems so"
so explain to us why Ford got the biggest funeral parade of any mayor in Toronto and I mean PARADE you should have been there to feel the love from the poor and the marginalized
You now accept Benedict as Jesus' Vicar.   LOL!!!  Five years ago you wanted to hang him.  Hypocrite!!!
Let me guess: M.W. ?Elizabeth is a gem among the Globe columnists.
