"B.C. citizens have finally seen the Right. That is, the so -called fake Liberal Right. Ontarians have seen the Right, too."
Your lack of Christian charity always amazes me.
Are you a muslim Alceste?
"Another minion of Satan. Bergoglio (Lord Of Flies) Continues his usurpation. All who help the anti-Christ who currently occupies Saint Peter's throne, will answer for this blasphemy.  Repent or be damned.   in nomine eius"
Belief in god is dying fast. Thank god.
"The North Korean 'people' really don't have much say now, do they?  But yes...when we have a draft dodging, chickenhawk, wanna-be tough guy saber rattling and gambling with the lives of our military men and women...transgender, straight, or whatever...it doesn't help the situation..."
Patrick D'Aloisio aww! Are they making fun of your Imaginary Friend?
"Very na?ve, I'm afraid."
"Pandora, just because you suffer from the delusion that women are not second-class citizens in the Catholic Church does not mean that others share your folly. These women were protesting an injustice. What is awful is your objecting to it."
Paranoid'? People pointing out a clear advantage FOR this individual in a field of competition are 'paranoid'? Fairness is taught in ALL fields competition. At all levels. From youth to professional. There is clearly something wrong here. Otherwise create a transgender division.
"Drug addiction is a malady, so compassion is warranted."
"It's no myth. Not only do they get paid quite well in Alberta but they are paid as 'independent contractors'-------------------------Ah. Not all tradespeople live in Alberta. That probably surprises you, though."
@MMackinnon Yes in the Chretien and Martin years there was a more peaceful world... Terrorists would not have blown up WTC in 2001 just a few miles south of the Canadian border.
"There are other ways to protect your home - martial arts, for example"
They still throw gays off buildings and stone women.
Members of one religion bombing members of another...just as Christians killed Cathars or Catholics killed Protestants (and vice versa) years ago. Maybe absolute certitude that you are hearing the true teachings of God is not always a good thing.
"Excuse me, people of Jewish descent are not asian. That is absurd."
"That's not exactly the reason why you were suspended though, is it?    From what I read, it was because of your open and supportive stance for gay marriage in defiance of Church teaching, your Twitter comments and activism....not because you are gay."
An amazing shot when you consider that the person who took it is a transgendered aboriginal.
"I presume a combat rosary saw service in Iraq or Afghanistan.  While Mary loves all the troops, I am not sure that Mary the Palestinian Jew would approve of any foreign occupation by an imperialist power, speaking of that other kind of Americanism."
"I don't think you can compare Trump wanting to keep criminals and illegal migrants out of the country to Hitler's disgust for Jews. Btw, how many Syrians has Israel adopted?"
"Earlier this week, 56 retired generals and admirals came out against Trump's ban on transgender troops, arguing it would be disruptive and degrade military readiness."
"Why would the daughter of a draft dodger, who has just slapped the face of every serving American transgendered person be chosen for a ceremonial task of honour?  Time to for the government to remove her from the guest list."
I didn't know journalism degrees come in crackerjack boxes. This girl no doubt got hired for her looks.
Damn that Trump!  Now he has turned blacks against Jews.
"Those pharisees said Jesus was a cafeteria Jew.   I don't know why, cause  Jewish food is delicious (except that gefilte fish, oy gevalt, it's shreklekh)."
"Nobody should be force to speak french it is ridiculous. | Canada needs to be split into four separate countries: French, Native, Catholic and Agnostic."
Cannabis has been used to treat addiction to hard drugs -- might work for Nicholson and Toews as well ... we could only hope.
GDP grew during the financial melt down of 2008 and onwards? Now who's drinking the coolaid.
"Sure you want people to be damned. If you did not want it, you would reject Canatate Domino and accept Dignitatis Humanae.  Your God is a bigot. He sends Jews to hell for being Jews. How does this differ from the Nazis sending Jews to Buchenwald for being Jews?"
"Catholic social doctrine is not owned by the 'left'. The Church was established by Christ as a hierarchical institution, not an egalitarian one; and was empowered to determine right from wrong based on revealed truths, not epistemic relativism."
hes way too smart. (the bar is low)
"No right minded person would want to enter those places, unless they were Muslims, what they call a place of worship is frankly a place to breed fear and judge people."
"Shame, indeed!  But Christians don't think laws apply to them.  You know, 'religious freedom' and all.  'Render unto Caesar. . . '  Oh, never mind."
"Target still hasnt recovered since their stock tanked after implementing their store's gun free status, and Obama's transgender bathroom nonsense.  How could this 'news story' ignore that 10,000 pound elephant in the room?"
"Utilitas, you keep insisting that all Trump voters are not racists.  Yet you are saying all Muslims are terrorists.  Do you see a problem here?"
Anti Muslim name????? How exactly is defending France against invading moors in 729AD 'Anti Muslim'?
When you start worrying about the 'human rights' of terrorists.................
Yes that's right. Only you and Fanfret know the path to truth. Which of course is why we dont need a referendum. Because we have Liberal Party hacks and spinners like you guys to design a new system for us.
"The truth hurts, don't it, Barry?"
"If Trump's goal was to ban all Muslims, why does his executive order apply to only 1% of the Muslims in the world?"
Don't think all black gay guys agree with BLM.  But because of the colour of their skin they are ignored by  media politicians and even BLM.
"More treacherous than Nixon?  Yet, the outgoing tyrant called white, christian, conservative a domestic terror threat.  Hey, Berstein, GPS!"
"No, because Muslims don't let their women out of the home.  They also don't have gender fluidity.  Therefore, the only option is a manhunt."
Canada was established on Biblical principles.
What Quebec wants is Chinese immigrants who drop off half a $-million on their way to Vancouver.
"True, we can just ask gays their experience and then trust them when they provide it. Sexual morality is for them, not for God. What bothers you more is not their morality but the public authority of the Church hierarchy, which God does not care about."
"He was getting fresh with the transgender woman, and she said 'Cut it out!'"
"The fact that this person is transgendered shouldn't matter. The real question should be, can she do the job?"
"I think Mr. Khan covered it pretty well.  In later interviews, Mrs.Khan addressed Mr. Trump's claim that she 'was a Muslim woman and, therefore, wasn't allowed to speak.'  Mr. Trump reminds me of the old 'Limbo Rock' lyrics..........'how low can you go?'"
If probably more than half the priests are gay why are they against gay people and their marriage rights? Are they angry they can't gay marry?
Liberals are still crying over the fact that Mateen wasn't a white Christian.
"As a Canadian trans woman living from time to time in the US I am feeling very vulnerable, and very angry. Thank you for stating this so well."
"OH NO! The snowflakes will have to pay for their education of black studies, women's studies and transgender studies! Oh the humanity!  The good news is that a degree in transgender studies will ABSOLUTELY help you get into a profession paying $150K year."
"Seth.. Good comment. I am very happy to see that there are some honest, capable people out there trying to help Ontario save itself from the largely left wing disaster called renewable energy."
"Don't worry. Trump has already played the transgender card to please his base. He's got GLB remaining, as well. If the heat gets too high for Trump, if he's not feeling the love, he'll make sure Hillary Clinton does the perp walk. The ratings on Fox will be yuuuge."
"Gay rights are more than marriage. But yes, if you are against gay marriage, you're a bigot. And you are a bigot. Roskell."
Why not post the names of the adults? Must've been another Christian hate group.
"Ad absurdum much? 6 million Jews, not arguable. 6 billion sperm? very arguable."
Great writing. As an ex parrot... er.. christian - it's good to hear of good sense in amongst the adoring patness.
"I think the G&M gets these 'articles' for free - and the authors thereby obtain a soap box for their pet diatribes, mostly uninformed !"
"Such clubs fan the spirit of victimhood and nurse self-focus.  Never a good thing to do.  I can't see St Maximilian Kolbe (feast day today) starting a club in Auschwitz for 'condemning the bigots' who gassed the Jews and himself.  Instead, he used all of his time very well...serving others.   Argument emptied."
so basically you're fantisizing about getting a legal reason to kill someone. You are a horrible person
"Hey, don't sweat it.  We kill thousands of Muslims every month over in the middle east.  We're well ahead in the body count."
He didn't take action with the Jews in Rome.  He actually let them be rounded up.
Most of us have grown up and no longer refer to gays as icky.  Time to move into the 21st Century.
"Was this story written by a jew? The import tax is now 300%. Tell you what Globe, cancel my fucking subscription. Period."
"GOD has changed?  Say what??  I doubt you studied Catholic theology on a graduate level; but if you did, get a refund."
"Funny, no parliamentary motion to quell the Quebec imam who preaches for the extermination of the 'accursed Jews.'"
"The press is trying to jump on every major and minor misstep Trump makes but many admire his politics. He has a very good chance of becoming the next president even though many, especially the establishment, do not like the idea."
"The fact that religion is based completely on faith alone does not necessarily make it 'unequivocally' crazy. Your well-written comment would have been much stronger (for me, at least) if you had chosen a better example."
Trump is their savior.  They said so.  If a protester is run over  by a car will Trump even speak about it?  The wery good people chanting â€œJews will not replace usâ€.  What a disgusting pos
"And here I thought we were doing so well, with not a cathouse or casino in town. I forgot about the homosexuals. No wonder we're being smitten.   (That was sarcasm, if anyone misunderstood.)"
Thank you for your service and may God keep all our military service members SAFE.
Star_Chaser - 'The most bigoted people I have seen here are the Harper haters.'Just like Israelis and Jews who oppose the policies of the Israeli government are 'anti-Semites'? Your attempts to criminalize political opinion are pathetic.
Canadians won't be in a position to say 'we have made amends' for at least a generation AFTER the government has demonstrated it is treating aboriginal people with respect. That has only just started after a decade of going backwards.
Gee the geniuses at the Glob of Muck are just finding out that Trudeau is just your garden variety lying Liberal ..brilliant !
"Transgenderism and other politically correct stupidity will be the downfall of Western civilization.  Sorry if this offends the minority, but most normal people are tired of this nonsense."
"Ruling government' !! That says it all. Like yourself, Harpo appears to think he was elected to reign over us."
Which military commander is saying that transsexuals are good for the military?  Name one.
"Sure it was, HM, but the shooter was born in the USA. A Muslim ban would have changed nothing."
A 'post-American era'--what is Hillary a secret Muslim like Obama?
"Shias, Sunnis, and all other Muslims as well as Christians, Buddhists, Hindus etc. can find a safe haven in Israel. Just stroll around the streets of Jerusalem and see all the various worshipers freely observing their religious practices."
"Oh boo hoo! Another sob story from the liberal Kool-Aid factory attempting to make us feel sorry for the most hateful, misogynistic, homophobic, racist group in Canada that produces the vast majority of terrorists. Not that the Globe is taking sides or anything..."
A transgender identy child has suicidal tenancies???  May want to inform the parents then.
"Let me get their logic straight: Jesus was a pedophile, so it's ok for Roy Moore to be a pedophile?  Wow.  Just wow."
"Pizi It makes no sense to occupy a strip of land partially occupied by and surrounded by your enemies. Nothing to do with ownership of the land.  If Jews bought Palestine, their reception would be the same. It makes no sense to.........................."
CDNWorker writes: 'Honesty and integrity do matter.'=============The recent Ontario election demonstrated that these two things are not particularly high on the list of voter concerns.
I could also ask why left-wing Catholics supported an amoral philanderer conman like Bill Clinton.
Don't you find it is becoming rather monotonous and predictable? It may seem to be parodying traditionalists but in reality it is a mockery of the Catholic Faith.
"forwhatisworth, When these people started 50 years ago to want to kill all Jews and continue to think like that instead of negotiating a settlement they deserve what they have. Terrorists are terrorists and desrve to live in ruins."
Yippee! And the point of this is what exactly? To trivialize homosexuality even further? I'm thinking opening the first all-gay lawn care service. That will make me 'courageous'!
"So the children graduating from Catholic Schools have actual knowledge that the Catholics Imaginary Supernatural buddy is a fraud and public School Grads do not?  Private Schools do better because they can refuse or expel problem students, or ones that require more resources."
"Russians didnt like Hilary Clinton, Israelis hated Obama (Bibis government) Both Russians and Israelis meddled in the election. But everyone is very quiet about the Israelis. Putin and Bibi hooked up last week never mentioned in mainstream media. I guess being Jewish has its privileges !"
"The ACLU says an estimated 8,800 or more transgender people currently serve in the military'. Are they referring to actual transgender, or just grouping as queer. 8800 sounds a bit high."
"Nothing but fears and jeers, Gay.  Keep whining."
"Trump's banning of transgendered people was certainly arbitrary but I don't think it will have a drastic effect on LGBTQ rights, especially not in Canada.  Their rights are too entrenched now. They have become unshakeable like the rights of women."
"That will be happening here in Canada very soon.... as a matter of fact, it may be going on right now.  In Richmond Hill there is a Muslim-only housing community where it's forbidden to walk your dog on a public street."
Or the incompetents that are running the liberal party now.
How about the rights of working Canadians who pay $14 BILLION a year in funding they get with no accountability?
What about your RoboCall Scam and the investigation and muzzling election Canada so they can't ask questions of the scammers? That doesn't bother you eh?
"the price we pay, low as it is, mostly goes to the middle man and not to the sweat shop workeryet progressives, leftists, socialists, Marxists in the West keep on buyingforgetting their public pose as advocates of Social Justice"
"No, he's not proTrump, but only because Trump is anti-Muslim. And unless you're a Muslim, Minshall has no use for you."
"Redford yet again shows She is more aligned with Her bretheren at the UN than Alberta... Lawyers do that, it's called Weasel words... used in an Election, then do something else altogether! One hit blunder this one..."
"Freedom of the press belongs to those who own one'It's the internet age. DIY, start your own website and let the comments fly. It's never been easier."
... it really is only about 20% support this monster.  What is SAD is that 80% of THAT 20% consider themselves Christian.  Disturbing!!
sorta like the anti infidel hate practiced by the Muslims.
"Joey, it's not the gay agenda, it's the black agenda. Membership has been declining since 1974, when the Boy Scouts were forced to integrate blacks into their troops. Equal rights are ruining the morally straight...."
"Oh they know, they just love having this as a stick to poke LGBT folks with."
When it calls me a 'rag-head' I disagree.  Guess since it's a tranny should be OK for me to punch it out without being accused of 'hitting a woman'...
"Neither is Bernie, but Bernie is also trusted by the people."
Forget the prejudice junk. And forget the neighbors junk. Practicality and economics.  And if you don't think an openly transgender in a barracks with 100 men isn't detrimental to the military mission then I give up.
 I don't see the death of Western Christianity as a bad thing ' .  It doesn't get much more pathetic than that.
Baloney! Separate school boards in Alberta feature prayers and Catholic religious courses. Holidays at Christmas and Easter are Christian celebrations. You'd do better to hide your prejudices and keep your shallow thoughts to yourself.
"if you are browsing these comments, you are definitely a divorced, unemployed loser. get a life"
We need a cohesive plan to get paid for our resources in cash in envelopes.
"These people here regularly hold up Westboro Baptist, the Catholic Crusades, and the Catholic Pedophilia as a model for Christianity, which is ludicrous, they only demonstrate their own ignorance and bias."
I don't know about 'constitutionalizing'. Parties are most certainly already legally recognized and given great power by both law and Parliamentary Rules.
Your equalization money.
Can you provide proof that the number of reported hate crimes against jews has been falling?
"Not like the right wing was obsessed for 8 years with the secret-Muslim, non-American, baby-killing Obama, no?"
Check the FBI and CIA sites for information on the religious affiliations of terrorist groups. There are definitely Christian-affiliated (self-identified as Christians) terrorists.
Pedophilia? Hmmm? Catholic much?
Catholicism certainly. They were expert terrorists.
"Yup, conservative politicians like Kenney who still can't force himself to say that lgbtq rights are legitimate, that gay support groups in schools are a good idea.."
Get used to it. Liberals believe that they have a God given right to tell all of us how to live their lives.
Thank you for such a fine article! I particularly listen up to the parallel between raw anger and raw empathy.
Bravo !  Hispanic Catholics are like Italians or Irish of a century ago....the next big winners in America's economic lottery.  Why Hispanic Catholics would ever want to copy-cat the Black Protestant Democratic Party disaster never made sense to me.
"I don't subscribe to a religion, but to a relationship with Jesus. I think for myself and strive everyday to act decently."
"Muslims are the worst Islamophobics of all . Ancient hatreds and wars of extermination between Kurds, Shiite, Sunni, Wahhabi, Druze and other Islamic sects are worse than anything expressed in the west, even by Trump."
"What trash, Tridentinus!  There are many who leave the Church for other very important reasons, the sex abuse cesspool for example.  Your rigidity reflects something entirely different from the Church of the Gospels."
"You have to admire Margaret for her willingness to take on sacred cows, whether you agree with her or not."
Your post is very short-sighted and uneducated......trans-gender restrooms has got to be just as important to the council.
"Right on! Each time Harper opens his mouth, I?m reminded of, ?I did not have sex with that woman,? and ?It?s not a crime, when the president does it.?"
"Get ready for more of this nonsense.  Once transgendered rights are elevated to the point of disallowing any thoughtful criticism, the lunatics will use their new found powers in ways that make 'self serving' an understatement to say the least."
"don't shoot the messenger Skeptical - if you all you have is insults and abuse, you have as much as admitted you don't have a position you can defend and the other right."
"No, we do not. You've had your day, get lost, buh bye."
He'd feel as safe as he did in the broom closet.
"Perhaps if you avoided hard liquor this early in the day, that may make a difference in how you approach the subject matter?"
Fair points on Adams and Blair.
"They're the intolerant and authoritarian type of people that are like this towards minorities. The authoritarian mentality has reared its ugly head in recent years using Muslims as the current scapegoat. In time, they'll drift away to other groups..."
So who's the bigger threat to Americans??? Islamic Terrorist or American Terrorist killing thousands of Americans in places like Chicago??? #MAGA
"The hierarchy of the Catholic Church in the USA are a rigidly politicized group. Their alliance with far right anti-gay forces, and their intellectually dishonest embrace of a phony notion of 'religious freedom,' makes them inevitable enemies of gay people."
"Paprocki is denying people in same sex marriage funeral rites, not gay people."
Learn to spell and/or proof your comments before posting.
"I (don't) know why, please inform me! That is why I posted my comment. It is not due to gay issue because the Boy Scout USA had already agreed that the Churches  can exclude Gay troop master's if they want to."
"You're just mad because we are the world superpower and have accomplished more than you, and you have nothing to say for yourself."
You look into people's eyes
All women are strong and are able to become leaders if they want to
"Of course, Naomi Klein's not arguing we should force the third world to pay for emissions reductions, but keep tilting at that windmill Ms. Wente."
"It's almost certainly ISIS or other Islamist terrorists.  A nightclub = booze + fun; Nightclub on the European side of Istanbul; Nightclub frequented by foreigners.  ISIS and other Islamists hate Europeans, booze and people having a good time."
Trudeau needs to talk about the millions murdered by Muslims. The fact their religion does not respect human rights.
Jewish fundamentalists (Haredim) in Israel would prefer a rabbinate rather than democracy- a Jewish version of Sharia law.
"Another, Want to ease the suffering of your working life? Don't suck up to your corrupt corporate employers and don't kick down on ordinary working folks."
"Some ex-Jews are so fed up with the false equivalence of Judaism with Zionism  that they have decided that they are not Jews. Don't dare speak out publicly, but can quietly avoid ticking the 'Jewish' box on the census."
"Dare yourself to travel to those banned countries, anytime? Be aware that not only americans have got killed in those places, but also europeans, and other non-muslim foreigners who happened to be there."
"The UN is sacred and all things Holy to Canadian liberals, never forget it."
"I'm more curious about the reaction to 1k gay priests saying 'We're gone!' More than a few have already gone to live their vocations in different pastures, and probably a few more will move on because of this."
"According to the author, to be in favour of human rights and against occupation and colonisation is 'pro Palestinian'. So logically support for Israel is........"
Transgender is a mental disorder. Doesn't matter if your liberal or conservative.
"So transgender does not include looking post-menopausal, huh?  At 66, real women do not look like this."
How about answering the question asked rather than throwing up a smokescreen?
We must build a wall to keep these transgendered sheep-lovers from invading the Homeland and forcing their boiled food on us!
"Justin is a devout Catholic, it's no wonder he believes the earth is flat and only 6000 years old.  If he's into cupping, perhaps he's into other forms of fakery.  Has he burned any witches at the stake recently?"
Admitting we have a Muslim problem would be the best staring point.
"Gee....when I bought a house in Anchorage in 1980 I thought I'd moved to Alaska.  Searched through your link.  Didn't find a reference to 'sex', or 'gender', or even the part word 'trans'."
"^ ^ ""the racists and the bigots have always been there... appeal to the lowest common denominator"""
"RD, wrong again.  Obama's was an effort to revet people from a country known to have terrorists.  Trump's is a ban on people from countries that just happen to be Muslim and where Trump has no business dealings."
"In fact, most people interpret what the CDF said as meaning that homosexuals are 'intrinsically disordered'. Homosexuals do almost unanimously."
I suppose that white men might also be transgendered so...
Gender based? Just male-female?  . What about transgender?
It's not hard to find out that Saudi Arabia would not exist without US support.
"This isn't racism. It's the truth. It is what it is. Unlike you, I'm not so arrogant as to believe the truth will never offend anyone."
"In other news, a person with a penis  is demanding the right to attend a women's only event where nudity is common. See: http://www.metronews.ca/news/toronto/2017/06/14/women-only-spa-s-no-male-genitals-rule-ignites-transgender-debate.html"
It takes a lot more integrity to grope women .................. and spy on 16 year old pageant contestants changing into their bikinis.
