"Oh yes we awful conservatives, only one solution. Put us all in zee camps und stoking up zee ovens."
All cats are stupid and mean
"Oh and the Liberals never lied, LOL."
Especially given that they deleted your most excellent comment yesterday for no good reason.
"Will67, histrionic is posting the same tombstone of bs in reply to post after post."
"This is an extremely bright, ambitious, competitive woman who would love nothing more than to exceed her predecessor's time in office.'Sorry... you lost me after the first comma."
Typical Harper bullying....Seems to work fer domestic relations......Let's give 'er a go fer foreign relations......If it don't work we can run and hide......like at home. Get right on that John....why do you think I keep you around!
"So f?hlt sich der Reichspropagandaminister stark genug, in seiner Position, die F?hrung der Partei die Nationalsozialistische Deutsche Arbeiter-Frage zu stellen."
"Wow, Ultra Sensitive.....! And seems to be many assumptions. I take it you attended the party to know all these things you are saying?"
It's well documented that you don't like Trump. The fact that you don't like Pence either is zero surprise to everyone.
"6 Canadians were killed in Burkina Faso not that long ago... they want to harm you in Ottawa, Ouagadougou, Nice, or New York."
Utter drivel and undeserving of further response.
"Don't you just love the yahoos (not the native Americans) who refer to people as 'these people'?Yup, middle of the road attitude ..."
Let us hope that the first casualty of the coming war will be the western mainstream media.
Its somewhat sad that many here confuse slant with fake. People should look up what people are talking about when the say 'fake news' before commenting.
It's about time.
"Um no. If i can't eat, what good is school or a lighted street going to do for me? I know people like you in the PS won't go hungry but I will. Perhaps you should read the article in the Financial Post..."
"perhaps, dave. but then they move on to things other than directly into politics. or marry people smarter than them ...oh, wait."
DaleyI like the idea of ' getting over it ' with a Scot.. Maybe while we enjoy a three finger sampler of the national beverage.. And consider questions like... If I'm a white guy in Ontario will my kids qualify to be a ' national minority' Argh!
"I am not sure what is silly, and if there is any story in what I wrote. You write about ""deniers in the same tone as Inquisition spoke about heretics. Interesting. Just confirms my impression of climate change as new religion."
No - he does not dither - see Cuba - the GOP wont let him do a thing otherwise.
"Joe, Joe, Joe... Try reading a newspaper or a book published outside Ontario my ignorant friend. Nobody cares about Mike Duffy west of Ontario - we just expect that kind of behaviour from the centre of our universe. BTW, have YOU tried crack?"
"If we left it up to all the Duggars families of world, what a mess we would have. Now those young girls will have to live with this incest all their lives."
"There are approximately 1.6 billion Muslims in the world. If they all thought like ISIS, we would have been eradicated years ago."
Really? So basically only fire fighters are entitled to comment? Nope. Sorry. I pay the taxes. I want MY tax dollars going where it is actually NEEDED not wanted.
Oh...be serious ...who made it an issue... The Trailer Park.. made it.
"Actually, he gave it away with the GST cuts -- the corporate tax cuts were simply a continuation of the plan initiated by the Liberals."
"It should be remembered that ?Nations have no permanent friends or allies, they only have permanent interests.?"
"Yet again, the G & M uses another female writer to promote legalization of prostitution to maintain male sexual privilege and entitlement."
"This legislation would have no impact on Islamist males. It impacts woman, Sikhs, certain Jews above all. Are you saying one can only be Canadian if one denies one's religion?"
The moderators are brutal; way to suppress free speech.
OH! What a marvellous idea!! All we'd have to do is firmly and strictly declare something like a War on Drugs.......Wait...
"In this specific case it doesn't matter at what point you define the moment of death. The first volley of shots was lawful, even if it meant Sammy was killed by them. The second volley of shots was not lawful, even if Sammy had survived."
See how valuable an education is? Now you're able to accurately describe the poverty you find yourself in.
Weird how you say 'a Muslim male (never a female)' but don't add that same part in parenthesis after priests or rabbis when it can equally be applied there.
"Hopefully, some of these more secular Israelis will end up in Canada.'Why?"
Margaret Atwood bores a lot of women too.
"Think you've 'done' it to yourself. Get some help, dude."
Mulroney's legacy whether you like him or not 1. North American Free Trade 2. GST if they are bad we had about 20 years to get rid of them so they must be good or we are lazy and incompetent grudgingly admit Mulroney left a legacy CHRETIEN left none
Itll be real interesting when Canadas Indians go to the Chinese government looking for reparations for loss of their homelands
They are poor because they are reliant on the drug trade and reliant on the drug trade because they are then poor. That cycle can be broken.
"Margaret says the battle is over? Ask the bigots at trinity western, or the BC gov."
Take their guns away and these cowards wouldn't last the day.
President Dwight Eisenhower arrived at Union Station on a visit during the Second World War.'Huh? What was Eisenhower president of during WWII? The Elks club?
At last someone trotting out facts instead of armchair prejudices.
Quebec Nationalists are zealots. They don't care about finances. They care about politics of language and identity and that's it.....
Yet again with the personal shots without any substance to your arguments. One has to wonder about your abilities.
you are a closet idiot
"https://www.whitehouse.gov/the-press-office/2015/11/06/statement-president-keystone-xl-pipeline No, he didn't."
That jobs in whch women predominate are lower paying is also part of the gender gap. Its not an either/or.
"...sure is a good thing CONs are spending our money monitoring these comments. the equallymonitored backbenchers are probably keeping tabs on here, too."
The Israeli snipers ( male and female) had a reputation for a lack of patients.''''Perhaps you are thinking of Israeli army doctors.
So you become more transparent by removing transparency acts. Got it.
Just maintain residency at your parents house. and come back and visit occasionally. Problem solved bleeding heart.
It's nice when a poster's punctuation mirrors the quality of their thoughts.
Rob Ford does not have the attention span to write editorials.
"I've learned to look at it as more of a game where I am ""beating"" the traditional job market. I'm (op) only 28 and most of my friends have very little in retirement savings, few assets. They are just now getting out of student loan and auto loan debt. It feels great to know I'm living so comfortably compared to most."
"ugh, put to rest that argument, it is so false. often people (well, me) will come to the site for the comments in response to articles and enjoy the knowledge that the sludge is not being ingested by everyone."
You probably really get off on the going's on in Congress. Serious stuff there.
"Certainly not Wente, who only speaks for the Cons and their misogynist Bible-thumping puppet-masters."
Won? Have you been sleeping under a rock since 1975? And why would you want to change the culture? Nothing wrong with the Vietnamese.
"Mr Paladin, the framers were, no doubt, well versed in the English language which you, evidently, are not. Try not to read things into a passage which exist neither in fact nor intent."
"Rather a silly remark there, watchlist."
The whole article ignores the fact the $3.1 billion figure is from the period covering 2001-2009. Who was in power from 01-06? Plenty of blame to go around.
Well we do have a surplus now. Perhaps we should give crack to all City Councillors.
"How about the young getting off their butts and voting and/or ( gasp ) campaigning on behalf of their interests ?!The likes of Marx, Lenin, Hitler were also 'inspiring' !"
"Keep up the censorship G&M, apparently only the Left is allowed to comment!"
"I understand the Liberal government will be bestowing two (2) taxpayer funded nannies each upon every wealthy trust fund family,"
"You claim there are gross exaggerations here. Yet, you do not cite a single one. Do you have a 'real case'? It would seem not, because you made a sweeping statement, then obviously deliberately neglected to back it up."
Not so much biased as clueless!
A truly twisted article by an obviously deeply wounded far right-wing academic.
It's the Pharmaceutical companies you should be watching over - duh!
But he is releasing his autobiography shortly so we will know what he has accomplished. It will likely be full of big words to make up for his short resume or what passes as deep thinking by JT.
Kevin O'leary Plays right in to the premier's hands. He may be loud. By She is much smarter then Kevin could even dream of being.
"No country deserves someone like trump. However, the gop does."
Now happily the Conservatives can be consigned to their well earned oblivion.
Don't worry. You ARE wrong.
"I don't agree with this (IMHO and all that, it ought to be done at the high school level) and, sorry, my comments do not exhibit 'the ugliness that ignorance produces'. I'll leave the irony of your comment to the reader to contemplate."
"Love your grown-up, partisan-based emotional outburst! It has really helped move this comment board's mature, fact-based discussion forward. Take care."
"if only we had a true head of state to slap hapers wrist. But we dont. We have a toad appointed by harper, acting as a rubber stamp for the other inbred rubber stamp who lives in an english castle and whose great grandson just pushed new teeth."
How is Harper going to take on ISIS from inside a closet ?
Short of taking selfies and spending billions on the world stage. Exactly how has he helped 1 Canadian? In order to get the god like accolades from fawning media?
"I would happy see him at the end of a rope, in his spare time he was making bombs to use against Canadian forces, you do remember those pictures of him ? Want to tell that to some of our dead troops"
 .. They invite criminals and inspire crime.... 'And without a casino there would be no criminals or crime ?!
"Sorry to interrupt a good vapid pontification, but it's 'Sunni', not 'Suuni'."
what will happen to your race if you don't produce more children?'My race is the human race. There are 7 billion of us. I'm not worried./discussion.
Ya but in Ontario the LIberals only rip off the tax payer. The Kadhar family rips off the country.
who does the clown mulcair speak for then?
"That's right, take your ball and go home... typical Con."
Many of you lefties seem to forget history. Martin raised EI premiums and passed all of the costs on to the provinces. You should get out more.
What a fool - Trudeau can try to put gloss over the obvious however the raw belly of Quebec society is showing.
Spoiler alert: long term consistent use of MJ can make you less bright and less motivated.
what a dull-witted nightmare.
"Governments spending taxpayer dollars on terra projects in hopes it will change the climate at sometime in the future , what possibly could go wrong?........lol........"
So the Reform party was 25 years ahead of the times? Pretty good for people the media liars referred to as Neanderthals.
Maybe it's time for the family owners to get off their lazy backsides and do the work themselves?
You think you're the only ones who deal with tragedy? There are lot's of others who make less than half of what you do. You simply aren't worth the price tag.
"To M1717- Your ignorance of Alberta is hilarious. Oh well, if you ever become knowledgeable of Alberta you might still be welcome here.."
"I doubt anyone in Toronto has a brain, especially Simpson."
"Trudeau: 'go ahead, watch me'Harper: 'Its too dark in here'"
"You're the second person in a week that has offended me, and many other rural people. It's B.S by the way"
Please do not share facts. Right-wingers are uninterested. Although you can focus on his wig or how he is junior George W Bush. THAT they dot on.
Thats a sexist stupid comment.
"PAS?' It doesn't need to be a physician. A nurse practitioner with a specialty in MAD?medically assisted dying?would do just as well and for less money. Whenever an article on MAD uses the word 'suicide,' I sense the menacing influence of religion."
So that encompasses whiny non smokers as well?
You can't discuss complicated things with simple voters.
"You really don't get it, do you Patwant- or you choose not to. Do you actually read the articles that you comment on?"
"oops my bad, Little Boy and Fat Man."
"Hi, dear Alborzagros, how are you?I woyld like just to say thank you, because you opened this page! See you soon! "
Ms Leitch is proof positive that having a degree doesn't mean one is educated.
"Harper, the manipulator that he is, is using the lone wolf shooting to further his fear agenda... if you cannot see this-you are blind"
"Junior Trudeau keeps proving he is in way over his head. An attack ad wasn't necessary, Junior proves it time and again."
"So, what are you trying to say?"
"If Grandma was a civic employee taking voting directions from a labour union, she deserves some blame for being so easily conned into bankrupting her children's cities."
David Smith another whiny Liberal.
"A little levity at Xmas with animals getting into heaven , my father did not think that Protestants could get into heaven must be a strange place , wonder what time cocktails are served????"
I wonder if Clinton will cry in public if she's ever indicted.
Is this a serious post?!?!
"; as expected you cannot read, understand and reason, or refuse to."
"Kurds should have their right to self-determination. And if they do, Canada should support."
Rotherham. Try google. And then tell us who is enlightened and who are the primitives.
"The French law has been used to stop Muslim mothers from helping out at school events and outings, and has resulted in them being ejected from the school bus in front of their children. How is that equality?"
Gramps Maybe stay in your room with the lights out and you will feel safer.
You must be a new Canadian.
She's an empty shell... She has risen politically far beyond her abilties or intellect. She will be known as the 'Photo Op Premier' as a short footnote in BC political history.
"Yeah, Harper can go to Helm."
Ken Maynard you've got some issues with reality
Uhm How long ago was Regan the President??? Oh wait you still gush over Trudeau I know!
"gasoline price fixing, no way. you must also believe in UFO s and sasquatch"
the Senate has a vote in this... HaHaHaHAAAAAHAAAAAAHAAAAArper!
Lefties want free speech and satire as long as the fundamentalist Muslims are not offended.
How about holding West and Saudis accountable.
"Trudeau will regret his quote (said many times): 'Mr. Harper wants you to believe thereare terrorists behind every tree, under every rock'. Unfortunately, it just takes ONE treeor ONE rock to do serious damage. A boy in charge, how sad."
The NDP gave their vote of confidence to S. Harper to take out the Liberals.
Canada's evaluation process is really weak.
Oh so now it's their fault for being killed because they mocked a backward violent religion? Nice. Should we kill the cast members of Monty Python because they constantly mocked Christianity?
"You were marketed to by the unions during the election. You bought it, and you're still buying it."
"Russians have excluded themselves from civilization, by invading Ukraine."
There's always room for a second center-left party. Just no room for extreme right-wingers.
Obviously you aren't aware of the funding issues at the OTPP and all public sector pensions. Who do you think is going to fund these pensions.
WHAAAAAAAAAAAAAAAAAAAAAAAAAAAAA!!!!!!!!!'Stephen Harper doesn't like us after we lie about him every day!'Time for an All You Can Eat Hunger Strike!
"3P, how dare you confuse the issue with facts."
Is anyone surprised? There can't possibly be anyone still surprised by these fricken clown's antics.
"Mor0nic post, Robert 320."
How can one work with 'silly'?
"The Snake' is baaaaack. Listen and learn, suicidal lefties, why Trump will win. People care for their families. http://www.breitbart.com/2016-presidential-race/2016/09/19/trump-busts-snake-terrorist-attacks/"
"Right, real men scrape razor sharp steel across their faces at least once a day denying their natural appearance. Get over it already. Nobody is objecting to you wasting thousands of hours of your life shaving."
Valid question / accurate point.
What science degree does Simpson have? Doesn't stop him from pontificating on global warming.
Haven' seen the 'lisping ' insult for a while. Some posters seem to have a bit of a fetish around that.
"The stories are because women are more thin skinned than men and demand to be protected from bad words. We must protect the women, women are weak and need protection. But they're also strong and powerful and can do anything a man can do."
If they return to Canada they can vote. If they remain abroad for 5+ years how is that 'valuable perspective' helping Canada?
Putin is really putting the sheep to work. At least it is gratifying to know that the Russian mob values Canadian perspectives.
Well you're presumably Canadian - so arguably it's not about you at all.
"actually, it is you who is not objective Canadians voted the CPC a majorty based on this policy"
"Judging by your thumbs down, you must have touched a raw nerve with the Ontario Liberal apoloigists."
"Rob The Cons have a 5% advantage straight off because they their supporters get out and vote, unlike the Lefty supporters that sit at home and watch TV."
LOL....when was India's history so illustrious?
"Canada also don't have to feed 20% of the worlds people with 7% of its farmland, and a hell lot less fresh water just laying around. Not comparable."
LRT Battle is lostmove on to fight other battles another day city and province and federal are now aboard the subway train don't waste leftist energy fighting futile causeslick your leftist wounds and get over it
"No, I am saying PINK people like yourself still think you are better than blacks and other races... your are damn wrong."
"In 20 years we can all end our comments, if comments still exist that is, with 'Allah is watching'. Cool, huh?"
I can't believe this absolute nonsense from this newspaper.
WARD NEEDS ANOTHER DRINK
LOL the writer 'admires' these things about Canada.. but has chosen to live in the USA and continues to live there.. for 'some reason'even with the 'promising' PM Photo- OP..when she does not have to live with the consequences..
Rhodes scholars were chosen because their parents were well connected; go back through 50 years of Canadians who were chosen and then check their parentage.
Utter tosh.
"I didn't realize that the conservatives lost the election on purpose. Thanks for that- I guess it explains the lack of a coherent plan, and so forth."
"It's not calling a spade a spade that's wrong, it's putting huge numbers of very different groups under your spade that is the problem. And if you discard an argument as hooey you make a display of yourself as blind and deaf."
NDP thinks big with national daycare plan.... Didn't Jack Layton and the NDP vote along side with stephen harper against this national daycare program when proposed by Paul Martin and the Liberals ???
I don't think the journalists really care one way or another. A more accurate description is most Canadians are left wing and thus a PM who was popular here would probably liked by the New York Times not Wall Street Journal.
What is the G&M's motive behind displaying 10 comments at a time? To inflate number of hits and extract more money from advertisers.
He wouldn't have to outlaw common sense as you already have none
"I fart whenever I want........just cannot control it.....When you say, Wynn I fart....when I read Wynn, I fart, When I see Wynn on the TV, I fart"
But it will be turned inside-out to please a few zionist financiers.
Boule sheet.
And aren't you just salivating at the idea of getting some kid of revenge. I invite any race or culture that has never 'sinned' to throw the first stone...
"Natives don't need 'accountability.' Show us the money 'Apparently that is NOT what the bands' auditors had to say, but I guess they must be wrong and racist as well?"
imagine actually being religious in 2019...did your parents not let you go to science class?
Trump supporters are the sorest winners around. This is what happens when you are the President elect and President. All your actions are held to account on a daily basis.
Who says it's impossible and when did your PM even TRY?????
"Yup, and the Iraq people asked the Western Political society to use false premises and invade them. It has worked out quite well for them. Only 250, 000 Iraqi civilians have died post invasion. I guess this is 'public interest'"
"Aren't marriages arranged by the parents, since it is forbidden and considered sinful for single women to talk to single men outside the family?"
"A white supremacist symbol has been showing up all over the world for many years now, on walls, tables and especially school books. How can this epidemic be stopped?"
"The West tolerates China because they are the manufacturer of the world, like they tolerate Saudi Arabia because that country has oil."
Is that marijuana on your breath? Your fired.
Gawwwwwwd seeeees alllllllll
Progressives are guided by hatered.
"Elect either of the other two nanny-state, tax & spend jokers and, trust me, the economy under the Tories will seem like economic Nirvana! Lol"
Somebody voted me down but provided no clue as to what Juneau said that Canada should have done. This column is an empty opinion piece to dump on the Liberals with no value added.
"Wait, Harris had an idea? What was it? This should be good."
Well then that drops Kenny from your list of future PMs. But I bet you didn't realize that now did you?
"It is to right wing fanatics. Adam and Even, tree of knowledge, original sin. It all makes perfect sense."
My how you add to the discussion.
"Shhh, Liberals need no encouragement to print money. Wynne doesn't have her own printing presses that's why she's electing Trudeau, he's got the presses."
Wente shows naked opportunism. I don't know if she's noticed but all political parties seize opportunities when they come around.
"The CBC is nothing more than a taxpayer funded mouthpiece for the left. Without taxpayer money, the CBC would be gone in a month."
Never. Progressives have a double standard.
Really - someone pays you to post this drivel or do you sit around all day waiting for inspiration? BTW - it's kumbaya and it means Come By Here (Lord). That song really should be right up your alley as you and Steve hold hands and sway.
Who is this woman and why is she in G&M debate? Didn't we move on from State religion vs Secularism like a hundred years back? She likes state religion - let her move to Saudi Arabia...
My favourite Republican quote of the past week: 'Democrats haven't been this angry... Since we freed their slaves '
Columbine was actually a failed bomb attack. Interesting that almost nobody knows that.
"copper5 - if you see this as 'done' now you are very, very naive."
"Underlying racist assertion: First Nations history, culture, and philosophy are of no value."
OH! What a marvellous idea!! All we'd have to do is firmly and strictly declare something like a War on Drugs.......Waitâ€¦
"Ah, death threats, huh? Where? I'm not able to scrape up a whole lot of sympathy for an entitled frat boy's poor choices."
"The last thing we need is a national daycare program. Children raised and indoctrinated to behave as state approved, politically correct, liberal robots? Isn't the traditional family unit damaged enough already?"
Popular? What is this.. 8th grade?
it was sad of harper to leave in the middle of a furneral just to make a stupid statement. maggie was glad to see him depart.
"Not to mention being able to spell a little better, too: 'dilema'??"
"Is America better off and the planet safer?'Only a hack would offer up this question, as though some doubt might exist about the answer."
I strongly suggest you fire this editorial writer - he has no grasp of reality. See other comments for WHY!
For Canada?s foreign-policy elite....'Nice of you to put the straw man of your argument in your first sentence.
Try telling that to RMiller. Not that it will help the poor fellow.
Gee no hacks here...
"The kids weren't allowed to speak their own language, much less harvest their traditional foods. Good grief, pick up a book, Bozo."
"Those cities you mentioned have high paying jobs in industries like banking and law. Vancouver has developers, realtors, and baristas."
"Yes, he basically said that ordaining homosexuals gave rise to child diddlers."
"Its easy, the climate policy of BO is a complete FAIL. He does make Al Gore rich though."
"Fine, let's see referendums across Russia. Maybe the Chechens would like out after the treatment they have received?"
Another 'No Brainer' moment for the Harperoids.
andrea... what is your point ??
What nonsense.
"Get the right team behind you, the answer is, Yeah, you can. ""teamwork"": it'll be nice to have a country governed by that again."
