"Wow, that Goldy is seriously racist.  It appears that Levant is a self-hating  Jew out to torment his brothers and sisters.  The Rebel is promoting hatred and division and Canada and should be investigated by the RCMP."
"Except that most of the Republican hierarchy have failed to serve their country in times of war....Bush, Cheney, Rove, Trump etc. And the American values you speak of are exclusive of white Christian right wing folk....a minority in this country today, and are the values of hatred and bigotry."
"No longer needing Jewish votes, Mr. Obama was free, finally, to punish the Jewish state in a way no previous President has done.  Can there by any doubtâ€¦any doubt whatsoeverâ€¦regarding the real purpose ofâ€¦the Iranian nuclear deal?!?"
The only way LGBT lives are 'hell' is due to the effect of the  blatant bigotry on the part of this 'Prince of the Sect.'
"Somebody should explain to President Trump that we defend our country with more than rifles and cannons. Our complex weapon systems now demand brains and training. On these requirements our transgender soldiers amply fit the bill. Indeed, more so."
"I hold the governing association responsible, not this transgender boy. He asked to wrestle with the boys and was denied. There is little question about the advantage he had over his female opponents by taking testosterone but, had he wrestled with boys, it would not have been an issue."
"So, let us assume that Milo has an excuse for his views on the gay love. I  wonder what's Bill Maher's or Samantha Bee's excuse for being crude and hateful?"
"Gays  are not imprisoned and flogged in Israel as in Gaza, Iran, Saudi Arabia etc.   Pride parades in Israel  None from Morocco across north africa to Pakistan"
Another 'commentator' from central Canada that doesn't know thing one about which he speaks.
"More accurately the Church of Jesus Christ of the Latter Day Saints reiterated its teaching that engaging in same sex activity is prohibited, and restating the consequences of flouting that teaching. Nothing here to see folks, move along."
"who knows, God may very well exist... I just don't think he's visited for quite a while"
Now maybe he will have to answer to his extremist views on women and gays.
You have demonstrated your ignorance of the Catechism.   Canon 915 certainly applied to Tim Kaine due to the fact abortion is intrinsically evil verses the issues of prudential judgement.  It's too bad there are uneducated Catholics like you and Bishop McElroy destroying this Church.
"Hypothetical... your daughter is a boxer, she's the champ... and the undefeated top contender is a Trans Female... you cool with it?"
Jesus blowing freaks are a curse on education.
Your stupidity rises so high I can't see it from down here. 
"if it is a reasonable search warrant, the courts could compel the defendant to provide the relevant password or hold them in contempt of court until they comply"
"UOIT is a rapidly growing university winning respect for its academic programs, particularly in the sciences. Try to keep up."
"No such thing as transgender - just males, females, and people with abnormal brain scans. Brain scans are abnormal among those who claim that they are really their own body's biological opposites."
"Black, exactly what do you suggest that the government should do? Be precise."
"One comment...WHO CARES?  What are there, maybe two transgender students in the state??"
"Marginalizing people', that's a laugh. You're the one to marginalize gay people. You also label people all the time. So, since you don't like homophobe, 'gay hater' will have to do."
"One wonders how many of these French are Jewish, escaping the rising wave of Judenhass that has swept France. Regardless, the result is to the betterment of Canada and PQ. Bienvenue, et SantÃ©!"
"If Trudeau's government pushes forward with this, and the items mentioned in the 'open government' article, I will have massive respect for him and the federal Liberals. That they are promising to do this is very, very encouraging."
Are you suggesting that when we meet a Muslim woman we should arrange to conduct our conversation on a telephone to get over the issue of not being able to see her face?
This shameless vote is probably the last episode of Obama's 'Arab Spring' - radicalization Muslims everywhere and replacing moderate Muslim regimes with militant extremists.
The purity of the blood eh? Where oh where have I heard that before?
"This is Liberal policy. Would Justin force all of his MPs to vote in favour? Would they have to be Pro-Euthanasia to even run for the Liberals? Would he accept any limitations at all, or would it be 'on demand' ?"
"It's not racial rights, it's legal rights in the treaties stemming from the Royal Proclamation of 1763. You might want to learn some of this nations history, JB0713, and accept your responsibility to observe the law."
All 'western' countries need to get their freaking act together and send lovely Muslims back to the middle east.  Let them fight it out for eternity.  Their problems are not our problems.
"Yeah, well ... Justin may be completely abusing his position, but Harper was literally the anti-Christ. Plus ... uhhh ... conservatives are bad and evil.   So leave Justin alone.   (Submitted simply to save some time for the usual apologists.)"
"Only partially facetious I blame that purple dinosaur, Barney. Where no one loses"
"Bravo. Let tolerance, equity and freedom be our passwords, and let them trump fear and hatred."
In the U.K. the word used was 'sissy'. It described boys who were unusually timid. Nothing sexual was intended as no one knew about homosexuality.
exactly first is was 'Who am I to judge?' about gays  then later he does not want gay priests  all platitudes like Justin Trudeau
Transgenderism is a guaranteed way of getting some attention when a youngster gets none at home.
Oh those poor criminals just trying to get free stuff
"Yes let's have free votes for culture war issues such as SSM, abortion, gun rights, prostitution, church and state, corporate lobbying, pipelines, whatever. It's more democratic that way."
Most Americans Support Open Transgender Military Service
There is no such thing as secular values. Maybe that's why?
Please mind you bigotry. We arent doing the 'gay equality is bad because of my god derp derp' stuff here.
"Talmud is a Jewish text.  Jews tend to be Democrats, not tRump supporters and stood with and marched with blacks during civil rights - so puh-lease get your name straight without insulting a whole group of people.  You were responding to 'tulimd'."
"There's some truth here... but as long as some Christians are pushing anti-science notions like 'intelligent design', it will be tough for the rest of us to take them seriously.  Personally. I think diversity is highly over-rated."
stoner' - a word with such positive connotations!
Stupid as saying all Christians are responsible for paving the middle east over the years when it has been mostly the US and Britain
IRT Boots - You my friend are factually wrong. There has never been a study that concluded any person with X&Y chromosomes did any better as a woman. In fact the leading pioneer in transgender research has stated emphatically; 'the change more often does long term harm.'
Spoken by an expert in 'brown lipstick'.
Ya where is the gender equality there??
Well it didn't take danepol too long to drag out that old canard - anti zionist = anti semitism! In fact I think Manjra is an equal opportunity phobe. His Islamophobia is positively shocking! And in Feinsteins casecase it is anti zionist=anti Semite=self hating non practising Jew!
"If the day comes when a LGBTQ  or Islamic university exists, and they forbid Christians from becoming students, unless they are silent about their faith, will the government be so interventionist? Will Christians even be allowed to attend?"
"excellent, Quinn is a complete dolt."
"Yes. If this was reported in a unbiased newspaper, it would read:  'Black Man with Ties to Alt-left arrested for Threats on Jews'.  but....wow...there is Just Too Much truthful, disturbing facts! -it Must be 'spun', it must be 'softened'. Disgusting!"
"I choose not to be gay, and I am a bad actor."
"Beyond hypocritical article. Obama has befriended rogue, anti-human rights, anti-gay enemies of democracy like Iran. Get over your fake news-based obsession with Russia and Trump, liberals."
"Conservative? I don't think conservatives make bomb threats to Jewish community buildings, I think Nazis do."
"If there's a bad choice available, Trump will make it! His latest pick of David Friedman as ambassador to Israel will most certainly not bring peace to the middle east. Does he want more Muslim extremists? Because that is how you get more Muslim extremists."
"So, people being 'believers' or transgender are legitimate concerns of yours? Mississippi would probably love to have you. P.S. I think the irritation in the back of your throat is probably just BS."
Yeah all cops strive for the day they can shoot and kill somebody! You really have no idea.....
"Delusions, hallucinations, fairy tales, religion. Not one ounce of evidence for any of it. Why is belief in Thor, Ramses and Zeus scoffed at?Religion is the last bastion of the ignorant."
The headline makes it sound like it's the School Board promoting hate. Not cool. It should read 'Ontario School Board's support prompts anti-Muslim backlash.' The school board is not fueling this hate. The hate is coming from bigotry and racism.
Islam permits true believers to dissemble in order to protect their beliefs and faith.
"If you are openly gay, does that mean you are sexually active?  Because that would merit suspension all by itself."
The fundies' war on gay marriage is ironic. They ought to welcome any support for a declining institution.
"Details, details RealistLon ... you must trust the Liberal Force, or be swallowed whole by the Dark Side. How else can a fledgling personality cult get a start?"
"And Palestinian's are the UN's chosen people in their objective of eliminating Israel and eradicating Jews from the region. Personally, I prefer God."
I agree the law should. But adding gays to if won't do that. Elimination of the law will.
"I might suggest looking up 'The Lords Resistance Army'  They are very much Christian terrorists.  I might also suggest looking at the terrorism perpetrated by the IRA, again, Christians."
Trump cited no credible source indicating that transgendered troops are a detriment to the effectiveness of the U.S. military.  It appears he is making statements like this to solidify his homophobic core supporters.
Im offended at your homophobic thoughts- you know its ok for one guy to like another guy.... even though that guy might be transgender-
"As your post demonstrates, Civil Comments has disabled the civility filter for the folks who were complaining about too many Catholic posts. Along with adding blocking, that puts things more or less back where they were with Disqus."
Trudeau and Harper are relatively close in age. You realize that right? Harper just looks older... and fatter.
"As long as he doesn't watch it, he can say: Still haven't actually seen video of the 'Jews will not replace us' thing. Sounds like an urban legend. Willful ignorance."
"and yet here you are accusing the Jewish Zionists of mere 'excesses' against non-Jews in Israel and saying absolutely nothing about Israel's barbaric, genocidal treatment of ten million Palestinians since at least 1935."
"I wonder what would happen if the Pentagon brass decided that tweets are not official orders, and simply waited for Trump's milliseconds-long attention span to be diverted elsewhere? 'General Dunford, is the transgender issue taken care of?' 'Yes, sir!' 'Fine. Carry on.'"
Rep. Hensarling will say it was gay people's fault.
Maybe Mary was bodily assumed into heaven because Jesus wanted to keep the Church from pawing at her bones?
What's your point - that this is normal and our climate is not changing? Wake up! The trend is clear based upon evidence. We are in a time of serious climate disruption with devastating consequences if we refuse to act to stop fossil emissions.
And just how would that ever be enforced with any confidence of integrity whatsoever! Your post is the perfect example of why our rights and freedoms are disappearing. You rationalize it for them (and for us). No thank you mog_man!
I suppose you're right. If it ends up being a Muslim who carried out the attack we can just call it muslim on muslim shooting. or Muslim Terrorist attack?
arab culture do not compliment western culture there will be many many problems to come
His supporters with racist aliases. Mexicans are rapists. Ban Muslims.
And fear and loathing of gays.
"Someday Lorna is going to tell us how important Christians among us - yes, even our most eminent churchgoing government leaders - practice the ethics and moral purpose that they take from the good book. But I will not hold my breath in the interval."
that commitment and ethic will bode well for the future........good luck
The usual sane analysis from Mr. Heinbecker.
"Can we say Islam is bad? Islam is threat to Canada? It's illegal to say such thing?   Can we discuss this topic:    if Muslim becomes majority in Canada, or even 20%, What kind of Canada will become?"
The suicide rate for homosexuals is 4x greater (CDC stat).  Use of psychoactive drugs high.  Gay in this sense is a huge misnomer.
"Canadian politicians promised to be nice to one another after the Jan 2011 shooting of Senator Gabrielle Giffords in Arizona. Like most promises from politicians, they are soon forgotten."
"...cannot be burdened with the tremendous medical costs...Again, our President is correct.' The military spends more on Viagra than transgender medical costs. The military has spent less on transgender medical costs than the country has spent on Donald's golfing hobby the last seven months. Your President is wrong again."
Killing is always a good thing...just ask Jesus in prayer.
you can knowingly infect someone with aids and it's ok. you can go to jail if you don't use the proper pronoun when speaking to the transgenders. are the flames hot enough yet.
This just in: Mass shooters are mentally ill. Wow. Really? Who'd a' thunk it?
"Good start, but don't forget about indigenous, visible minority and trans-gender. I'm not making fun.  These and other categories follow closely on attempts to correct imbalances politically."
"Sure, because such medieval nonsense has absolutely no bearing on having faith in Christ and following his teachings. Why dabble in this extra-biblical nonsense which, as we have seen, so easily lends itself to abuse, corruption and distraction?"
Protestants? Jews?
This must be the work of Satan.  They probably rejected Christianity as being a 'white man's religion'.
Black Pride = being black and proud Gay Pride = being gay and proud White Pride = NAZI! - Hypocrisy is a greater crime than racism.
"Since my prostate surgery so do I, but I do it in the proper gender assigned bathroom unlike the mentally deficient phony group calling themselves 'trans people'. You are as you came into the World, and even assignment surgery does not change fact to fiction."
"A one legged, multilingual ,trans, first nations, marxist should be appointed."
I am sorry to hear that you were homophobic and hope you have overcome it. As a Catholic I am not and have never been homophobic so I have never had the need for such an examination.
"I am white. Not a single one of my rights is threatened by my Muslim or Chinese neighbours. On the other hand, I do feel threatened by ignorant people who see immigrants and people of colour as the enemy."
"her grandfather was a Nazi , or a Nazi collaborator and  clearly  a propagandist.  Basic fact .   Her  grandfather helped kill Jews in the millions  Has she ever admitted this  fact while attacking Russia today and defending Nazi collaborators in her own family ???"
"It's a simple fact that there is no mention of a sexual encounter in the report. It's a quick read, you should check it out. By your logic, is everyone who does not support her a homophobe? I am neither a lesbian nor a homophobe, nice attempted troll though."
"Nancy Pelosi is right. She is the top Democrat fundraiser so black, liberal and transgender Democrats should best shut up and stop complaining. It's her party and she is the boss."
I've already popped the pop corn. How will Francis deal with this magna cappa pirate. (There is gay humor lurking in this analogy somewhere!)
"Here are Kristin Beck's (a transgender ex Navy SEAL) own words to Trump:  ''Let's meet face to face and you tell me I'm not worthy,' Kristin Beck, a 20-year veteran of the Navy SEALs, told Business Insider on Wednesday. 'Transgender doesn't matter. Do your service.'  http://www.businessinsider.com/kristin-beck-trump-transgender-ban-2017-7"
These warlock Dems did not deny Catholics when president Kennedy won they just killed him.  May God forgive them.
Islamophobia is completely justified because Islam is the religion of the Quran of which the unbeliever or infidel is to be killed in the most brutal means and  sharia law imposed.
Except there is no God.
"Arguing in neo-Marxist platitudes? Yes, that person was born a he, so it seems nature is 'anti-trans microaggressing,' according to your neo-Marxist Critical Gender Theory beliefs."
"For the Gay community and the Black community, both whom have been successfully pressing for broad inclusion to exclude the police whom the vast majority of people strongly support, is more than ironic.  It's just plain wrong.  Count me out his year."
"You must be a Republican.  Swirling black hole where your heart should be ... Hatriotism!!  Praying hard to the money gods while calling yourself a Christian, but we all know by now today's Christian is a 'christian'.  Super fakey!"
The gays need colonoscopy.
And don't forget that their version of Islam throws gays off buildings.
"Yeah, it's clearly too hard. Let's just give up and let the carnage continue."
That was simply an excuse... The average German soldier will claim they never fought to exterminate the Jews....
The Pharisees are the predecessors of rabbinical Judaism. Isn't it way past time Christians dropped the whole 'you killed our Lord!' talk?
Americans know something Canadians don't. No one really wants to look at a Muslim woman.
Amen brother
Considering transgender bathrooms 'fringe' is what will get you tarred and feathered in a modern university.  You are an 'old-fashioned Marxist' stuck in the 60s.
So what is the percentage of the 3 out of 1000 people that are transgendered that want to enter the military? Maybe the transgendered should pick other battles.
Lesbian reject men so why should men protect them?
"oh please, you think the session moderated by Independent Jewish Voices, a notoriously Israel and jew-hating organization, is going to be a fair and balanced discussion on human rights?  What utter nonsense."
"Knowledge is power. Less knowledge for the public means more power for the government and the elites. The powerful become more powerful, the powerless become more powerless. That's the way the powerful want it."
"Oh great, thanks to Trudeau Canadians are now effectively forced to buy Middle Eastern oil and to fund islamist terrorism whether they like it or not. Meanwhile, Paul Martin's shipping company can continue to lavishly profit from the tanker trade. Coincidence?"
"Fake Senator, Fake Tories, Fake Christians..."
Could we have a list of acts of terrorism committed by Syrians in North America? Or anywhere?
This clarifies the situation - or does it? Is the Queen gay?
"The law is cowardly.  These same Quebec Liberals went to the funerals of 6 dead Quebec City mosque members back on January, 2017.  Ten months later, they make a law that targets Muslims.  I guess for Quebec Liberals, the grieving period was over."
This is a huge mistake and a setback for acceptance of the gay community. If I lived in Toronto I would boycott the parade after this decision.
Maybe they should have a transgender division - the current system doesn't seem fair.
That explains all those Jews getting put to death in Israel for cursing their parents.../s
"I have to call bs here. I'm a churchgoing Christian, and there is nothing in our teachings that says it's okay to prey on young girls. These people are lunatics. It's not okay to generalize. There are lunatics in every faith (or non-faith)."
"London, as well as most of Europe, is deteriorating rapidly.  London now has a Muslim mayor which shows how they have infiltrated all levels of government."
"You conveniently don't mention your cohorts who call for extermination of Jews and Blacks. With guys like IQ006, IQ22, and the rest in your corner, well, I wouldn't call you  loathsome or deplorable like them but I think ' imbecile' has some merit for your selectivity."
Is  LBB  Barry  back  from  his  gay  sex romp  in   the  south  seas  yet?   When  he  left Moochelle at  home?
"At least in that they continue the traditions of the Church, as Saint Pope John Paul II the Great was a firm believer in protecting pedophile clergy."
Muslim prayers are certainly something to be afraid of.
"You are still saying that two deaths are better than one. Which is 'pro-death', not 'pro-life'.   You claim I am not a proper Catholic, which shows your innate arrogance."
Really? I guess you could just flood your data base with fictitious information and aliases but heaven help you if one of your aliases turns up being wanted by law authorities. Maybe the trans world where you can be 'fluid' has some merit (eyes rolling).
"Patsi writes:  'Tommy went out of his way to attack Paul Godfrey of the National Post for being Jewish. '  -  No, I've attacked him for being a failure as a CEO.  Never mentioned that he is Jewish.  Try harder to be accurate, Patsi."
Transgender people allowed in militaries of 18 countries' So what? The USA isn't one of them.
"***And for my next comment, I will channel Roy's justification for everything***  You want Trump to fire someone just because he doesn't like Jews?  What is this? Nazi Germany?"
"It doesn't make sense from a military perspective to ban transgender service members.  Trump tweeted it to shore up the homophobic sector of his base of supporters, which also includes racists, xenophobes, Islamophobes, and sexists."
"The Democrats use Antifa like the Muslim community uses radicals. They turn a blind eye to it until it is pointed out to them, then they shrug, throw up their hands and complain there is  nothing they can do."
You do realize that segregation of the sexes is not limited to Islam right? What about Orthodox Judaism? It's just as sexist. Come to think of it Catholicism is pretty sexist too.
"Dual citizen ship is a No No. One can not serve two masters. When one bows to master one its but is facing master two and vice versa. You come to Canada embrace it. If one is sceptical, Just do not apply for citizen ship fair enough."
"President Trump has been the most pro-Isreal president to date.. why would you hold him responsible for any anti-semitic acts? Why not blame the only people who still, to this day, hate jews? (im referring to the religion that literally preaches about killing jews.. and it rhymes with ShmIslam.)"
"That's funny. It's not like muslims have killed over 1,200 innocent people in terrorist attacks within the last month. Oh wait, yes they have.  https://www.thereligionofpeace.com/"
The only false equivalence is on your side. Christians have killed and terrorized throughout history in the name of God. You know it. Stop pretending.
Gay pornography?
The Queen's kids should hold another one this week. Flip the bird to the insecure world.
"You DO understand that the term 'progressive' and 'Conservative' are counter to each other, right? That is why they took it out to begin with. The proggy hate is string today."
"That would be people from both parties , I know many democratic and republican White Christian Gun Nuts that vote , Some are not party drones ."
"Self-hating Jews subscribe to the Forward. Jews in name only. Artificial Jews. Other than being born to a Jewish mother, you wouldn't know they were Jewish."
So funny and so hypocritical - coming from such a pro-Muslim crowd of politicians.
"Let's hope that the Liberals , by getting hit on the head by the 4 by 4 of reality, make some wise decisions... the ship of state was manouvered successfully through the global economic maelstrom by the previous government and now comes another."
The Israeli's like their combat females..a lot.  They also have no issues with transgendered military personnel.
Any adult who thinks he or she is a child suffers from some type of disorder. Most transgendered adults do not suffer from this disorder. I doubt there are too many baby-wannabes in the military.
"After 44 years of the P.C.s and decades of Social Credit before that, Albertans have had enough of the 'right' for a while and are willing to give the NDP a chance. We'll see in three years if the NDP deserves another mandate."
Good move. Obama's LOVE for all things anti-American and communist was irrational. No reason to support a muderous regime. Now NIX the Iran deal....and Obama's love for all things anti-American and islamic.
Jesus had two dads .Seems there are a few people out there who think he turned out ok .There are more reports of elected officials abusing kids in bathrooms than transgender folks .
Dostoevsky is turning over in his grave that the likes of you has appropriated that name.
Racial hatred and white nationalism are the glue that hold the Trump coalition together.  It is the duty of every Christian to oppose it.
